{
  "name": "cursor-plugins",
  "owner": {
    "name": "Cursor",
    "email": "plugins@cursor.com"
  },
  "metadata": {
    "description": "Official Cursor plugin marketplace: developer tools, framework rules, MCP integrations, and agent skills"
  },
  "plugins": [
    {
      "name": "teaching",
      "source": "teaching",
      "description": "Skill mapping, practice plans, and learning retrospectives."
    },
    {
      "name": "continual-learning",
      "source": "continual-learning",
      "description": "Incremental transcript-driven memory updates for AGENTS.md using high-signal bullet points only."
    },
    {
      "name": "cursor-team-kit",
      "source": "cursor-team-kit",
      "description": "Internal team workflows for CI, code review, shipping, local automation, and verification."
    },
    {
      "name": "thermos",
      "source": "thermos",
      "description": "Thermo-nuclear branch review: deep security/correctness audits, harsh code-quality rubrics, parallel subagents, thermos orchestration, and optional merge-ready PR flows."
    },
    {
      "name": "create-plugin",
      "source": "create-plugin",
      "description": "Scaffold and validate new agent plugins."
    },
    {
      "name": "ralph-loop",
      "source": "ralph-loop",
      "description": "Iterative self-referential AI loops using the Ralph Wiggum technique."
    },
    {
      "name": "agent-compatibility",
      "source": "agent-compatibility",
      "description": "CLI-backed repo compatibility scans plus agents that audit startup, validation, and docs against reality."
    },
    {
      "name": "cli-for-agent",
      "source": "cli-for-agent",
      "description": "Patterns for designing CLIs that coding agents can run reliably: flags, help with examples, pipelines, errors, idempotency, dry-run."
    },
    {
      "name": "pr-review-canvas",
      "source": "pr-review-canvas",
      "description": "Render PR diffs as review canvases grouped by importance."
    },
    {
      "name": "docs-canvas",
      "source": "docs-canvas",
      "description": "Render documentation as a navigable canvas."
    },
    {
      "name": "cursor-sdk",
      "source": "cursor-sdk",
      "description": "Build apps, scripts, and automations with the TypeScript SDK."
    },
    {
      "name": "origin-apps",
      "source": "origin-apps",
      "description": "Skills for building on the Cursor Origin API. Fetch the live spec first, then follow the Origin rules for credentials, scopes, webhooks, paging, and errors. Includes a skill that plans the port of an existing GitHub App."
    },
    {
      "name": "orchestrate",
      "source": "orchestrate",
      "description": "Fan large tasks out across parallel cloud agents with planners, workers, verifiers, and structured handoffs."
    },
    {
      "name": "pstack",
      "source": "pstack",
      "description": "if you want to go fast, go deep first. pstack helps you write less, but higher quality code. rigorous agent workflows you can parallelize with confidence."
    },
    {
      "name": "dyl-stack",
      "source": "dyl-stack",
      "description": "Dylan's agent style on top of pstack: root causes over symptom patches, The Algorithm before design, terse verified delivery, a PR review that fits in a paste, and Figma-to-UI with a visual judge."
    },
    {
      "name": "grok-voice",
      "source": "grok-voice",
      "description": "Add Grok voice to an app: realtime speech-to-speech, speech-to-text dictation, text-to-speech read-aloud, and a log-driven fix loop for voice sessions."
    },
    {
      "name": "advisor",
      "source": "advisor",
      "description": "Consult a stronger model before major decisions, when stuck, and before declaring done."
    },
    {
      "name": "gmail",
      "source": "third_party/gmail",
      "description": "Search, read, draft, and manage email."
    },
    {
      "name": "google-drive",
      "source": "third_party/google-drive",
      "description": "Search, read, create, and share files."
    },
    {
      "name": "google-calendar",
      "source": "third_party/google-calendar",
      "description": "Search events and schedule meetings."
    },
    {
      "name": "google-docs",
      "source": "third_party/google-docs",
      "description": "Read, create, and edit documents."
    },
    {
      "name": "google-sheets",
      "source": "third_party/google-sheets",
      "description": "Read, write, and append spreadsheet data."
    },
    {
      "name": "google-slides",
      "source": "third_party/google-slides",
      "description": "Create, edit, and render presentations."
    },
    {
      "name": "google-ads",
      "source": "third_party/google-ads",
      "description": "Report on campaigns, research keywords, and make previewed changes."
    },
    {
      "name": "gong",
      "source": "third_party/gong",
      "description": "Pull account summaries, deal insights, and call briefs."
    },
    {
      "name": "salesforce",
      "source": "third_party/salesforce",
      "description": "Query, create, and update records in your org."
    },
    {
      "name": "salesforce-headless-360",
      "source": "third_party/salesforce-headless-360",
      "description": "Manage records, users, and org setup across Salesforce."
    },
    {
      "name": "playwright",
      "source": "third_party/playwright",
      "description": "Navigate, click, screenshot, and test in a real browser."
    },
    {
      "name": "github",
      "source": "third_party/github",
      "description": "Manage repos, issues, pull requests, and Actions."
    },
    {
      "name": "ashby",
      "source": "third_party/ashby",
      "description": "Search candidates, prep interviews, and manage pipeline tasks."
    },
    {
      "name": "greenhouse",
      "source": "third_party/greenhouse",
      "description": "Search candidates, jobs, and applications, and review scorecards in Greenhouse Recruiting."
    },
    {
      "name": "hubspot",
      "source": "third_party/hubspot",
      "description": "Search and update contacts, companies, deals, and tickets."
    },
    {
      "name": "intercom",
      "source": "third_party/intercom",
      "description": "Search conversations, contacts, and Help Center articles."
    },
    {
      "name": "zoom",
      "source": "third_party/zoom",
      "description": "Search meetings, pull transcripts, and work with Zoom Docs."
    },
    {
      "name": "x",
      "source": "third_party/x",
      "description": "Search posts, read timelines, pull trends, explore Spaces and communities, manage lists and bookmarks, access X Chat, schedule X calls, and manage livestreams."
    },
    {
      "name": "clay",
      "source": "third_party/clay",
      "description": "Enrich people and companies, run AI research agents."
    },
    {
      "name": "circleback",
      "source": "third_party/circleback",
      "description": "Search meetings, transcripts, action items, and emails."
    },
    {
      "name": "docusign",
      "source": "third_party/docusign",
      "description": "Manage envelopes, templates, workflows, and agreements."
    },
    {
      "name": "navan",
      "source": "third_party/navan",
      "description": "Query expenses, travel bookings, policies, and cards."
    },
    {
      "name": "profound",
      "source": "third_party/profound",
      "description": "Track AI visibility, sentiment, and citations."
    },
    {
      "name": "juicebox",
      "source": "third_party/juicebox",
      "description": "Query recruiting analytics, shortlists, and sourcing agents."
    },
    {
      "name": "outreach",
      "source": "third_party/outreach",
      "description": "Search sequences, prospects, and Kaia meetings."
    },
    {
      "name": "amplemarket",
      "source": "third_party/amplemarket",
      "description": "Search people and companies, enrich leads, run sequences."
    },
    {
      "name": "klaviyo",
      "source": "third_party/klaviyo",
      "description": "Manage profiles, segments, campaigns, and flows."
    },
    {
      "name": "customer-io",
      "source": "third_party/customer-io",
      "description": "Build campaigns, manage segments, and query people."
    },
    {
      "name": "mailerlite",
      "source": "third_party/mailerlite",
      "description": "Manage subscribers, groups, campaigns, and automations."
    },
    {
      "name": "brevo",
      "source": "third_party/brevo",
      "description": "Manage contacts, email and SMS campaigns, and CRM deals."
    },
    {
      "name": "typeform",
      "source": "third_party/typeform",
      "description": "Build forms, analyze responses, and manage contacts."
    },
    {
      "name": "jotform",
      "source": "third_party/jotform",
      "description": "Create and edit forms, then read submissions."
    },
    {
      "name": "semrush",
      "source": "third_party/semrush",
      "description": "Research keywords, backlinks, traffic, and competitors."
    },
    {
      "name": "ahrefs",
      "source": "third_party/ahrefs",
      "description": "Research keywords, backlinks, rankings, and site health."
    },
    {
      "name": "godaddy",
      "source": "third_party/godaddy",
      "description": "Brainstorm domain names and check availability."
    },
    {
      "name": "upwork",
      "source": "third_party/upwork",
      "description": "Search talent, post jobs, and manage contracts."
    },
    {
      "name": "workable",
      "source": "third_party/workable",
      "description": "Search candidates, move pipelines, and manage HR records."
    },
    {
      "name": "brex",
      "source": "third_party/brex",
      "description": "Query expenses, receipts, bills, cards, and travel."
    },
    {
      "name": "todoist",
      "source": "third_party/todoist",
      "description": "Create, find, and complete tasks and projects."
    },
    {
      "name": "calendly",